title,link,date,source
Elektra Awards 2025 open for entries,https://www.electronicsweekly.com/news/elektra-awards-news/elektra-awards-2025-open-for-entries-2025-05/,Posted on 20th May 2025 | Modified on 21st May 2025,Electronics Weekly
NMI hosts industry conference in Glasgow with theme of growth,https://www.electronicsweekly.com/news/nmi-hosts-industry-conference-in-glasgow-2025-03/,Posted on 18th March 2025 | Modified on 18th March 2025,Electronics Weekly
DigiKey introduces own-brand DigiKey Standard product line,https://www.electronicsweekly.com/news/business/distribution/digikey-introduces-own-brand-digikey-standard-product-line-2025-05/,Posted on 7th May 2025 | Modified on 7th May 2025,Electronics Weekly
CHIIPS podcast interview with industry veteran Ash Madni,https://www.electronicsweekly.com/blogs/electro-ramblings/site-update/chiips-podcast-interview-with-industry-veteran-ash-madni-2025-04/,Posted on 28th April 2025 | Modified on 28th April 2025,Electronics Weekly
"Get Mannerisms, Gadget Master, the Daily and the Weekly, in newsletter form",https://www.electronicsweekly.com/blogs/electro-ramblings/site-update/get-mannerisms-gadget-master-daily-weekly-newsletter-form-2025-06/,Posted on 5th June 2025 | Modified on 5th June 2025,Electronics Weekly
"Elektra Awards 2025 looking for tech stars – companies, entrepreneurs and designers",https://www.electronicsweekly.com/news/elektra-awards-2025-looking-for-tech-stars-companies-entrepreneurs-and-designers-2025-06/,Posted on 3rd June 2025 | Modified on 3rd June 2025,Electronics Weekly
IPC praises President Trump for defence industry support,https://www.electronicsweekly.com/news/ipc-praises-war-hating-president-trump-for-defence-industry-support-2025-03/,Posted on 28th March 2025 | Modified on 28th March 2025,Electronics Weekly
IPC sets the industry on the path to sustainability,https://www.electronicsweekly.com/news/ipc-sets-the-industry-on-the-path-to-sustainability-2025-03/,Posted on 27th March 2025 | Modified on 27th March 2025,Electronics Weekly
Imec launches Stuttgart advanced chip design accelerator,https://www.electronicsweekly.com/news/design/861118-2025-03/,Posted on 31st March 2025 | Modified on 1st April 2025,Electronics Weekly
Auto hi-voltage detector claims fastest response time,https://www.electronicsweekly.com/news/products/power-supplies/auto-hi-voltage-detector-claims-fastest-response-time-2025-05/,Posted on 16th May 2025 | Modified on 16th May 2025,Electronics Weekly
